{
  "$schema": "https://json-schema.org/draft/2020-12/schema",
  "$id": "character.schema.json",
  "type": "object",
  "required": ["id", "name"],
  "properties": {
    "id": {"type": "string"},
    "name": {"type": "string"},
    "must_keep": {
      "type": "object",
      "properties": {
        "hair": {"type": "string"},
        "outfit": {"type": "string"},
        "accessories": {"type": "array", "items": {"type": "string"}}
      },
      "additionalProperties": true
    },
    "references": {
      "type": "object",
      "properties": {
        "images": {"type": "array", "items": {"type": "string"}}
      },
      "additionalProperties": true
    }
  },
  "additionalProperties": true
}
